id,title,state,created_at,updated_at,closed_at,body,user,url
I_kwDOCdlEl85Ii7gN,Bug in input file detection,CLOSED,2022-04-27T10:01:34Z,2022-04-27T10:28:10Z,2022-04-27T10:27:58Z,The pipeline does not show any error when a missing input file is provided in the parameter file.,fran-romero-campero,https://github.com/fran-romero-campero/MARACAS/issues/2
I_kwDOCdlEl85IjFmL,Peak calling does not work for TF,CLOSED,2022-04-27T10:33:15Z,2022-04-27T11:49:53Z,2022-04-27T11:49:36Z,,fran-romero-campero,https://github.com/fran-romero-campero/MARACAS/issues/3
I_kwDOCdlEl85IjaQ2,Bug when a single replicate is used in ChIP-seq analysis,CLOSED,2022-04-27T11:50:21Z,2022-04-27T12:22:22Z,2022-04-27T12:22:22Z,,fran-romero-campero,https://github.com/fran-romero-campero/MARACAS/issues/4
I_kwDOCdlEl85IkTKa,Bug in Processing sample 2 of histone modification,CLOSED,2022-04-27T14:52:58Z,2022-04-29T09:33:59Z,2022-04-29T09:33:59Z,"
![φαφα](https://user-images.githubusercontent.com/83277351/165547820-8dbf9e36-a473-401f-bea0-069330c27ce4.png)

",XristinaAr,https://github.com/fran-romero-campero/MARACAS/issues/5
I_kwDOCdlEl85IvUS6,"Missing link in text ""Click here for an example of result report in pdf format and an example of report in html format.""",OPEN,2022-04-29T09:38:36Z,2022-04-29T09:38:36Z,,"Results generated by MARACAS
The final reports and the intermediary result files generated during the execution of the MARACAS pipeline will be saved in the folder specified in the parameter main_folder.

[Click here to download a compressed example folder generated by MARACAS for an RNA-seq analysis.](https://github.com/fran-romero-campero/MARACAS/blob/master/examples/rna_seq_test.zip)
[Click here to download a compressed example folder generated by MARACAS for a ChIP-seq analysis.](https://github.com/fran-romero-campero/MARACAS/blob/master/examples/chip_test.zip)
The MARACAS output folder for an RNA-seq data analysis consists of the following subfolders:

samples This folder contains a subfolder for each sample whith files for quality control, mapping stats, normalized mapping signal in bigwig format, transcript assembly and mapping information for exons, transcripts and introns.

results This folder contains the information of the final results collected in two reports in html and pdf format. 

Click here for an example of result report in pdf format and an example of report in html format.",XristinaAr,https://github.com/fran-romero-campero/MARACAS/issues/6
