id,title,state,created_at,updated_at,closed_at,body,user,url
MDU6SXNzdWUyMDM4MjgwNTI=,Make error associated with naming of SAM and BAM files clearer to show users exactly how they should be named,CLOSED,2017-01-28T20:06:12Z,2017-01-28T20:46:52Z,2017-01-28T20:46:52Z,,tovahmarkowitz,https://github.com/hochwagenlab/ChIPseq_functions/issues/1
MDU6SXNzdWUyMTQ3NTM3OTU=,Double normalization,CLOSED,2017-03-16T15:59:47Z,2017-04-24T18:18:50Z,2017-04-24T18:18:50Z,Put double normalized peaks and wiggle files into a single folder outside of the individual normalizations,tovahmarkowitz,https://github.com/hochwagenlab/ChIPseq_functions/issues/2
MDU6SXNzdWUyMTQ3NTQwNzU=,Double normalization,CLOSED,2017-03-16T16:00:40Z,2017-04-24T18:18:50Z,2017-04-24T18:18:50Z,Make it possible to start with FASTQ files for double normalization pipeline,tovahmarkowitz,https://github.com/hochwagenlab/ChIPseq_functions/issues/3
MDU6SXNzdWUyMjQyMDA3MzI=,Put pipeline v3 library files in dedicated folder,CLOSED,2017-04-25T16:39:55Z,2017-04-25T22:46:19Z,2017-04-25T22:46:19Z,Name the folder after the Bowtie version.,luisvalesilva,https://github.com/hochwagenlab/ChIPseq_functions/issues/4
MDU6SXNzdWUyMjQyOTQwMTE=,ChIPseq_closing doesn't run if other jobs are stuck in the queue due to prior files failing.,CLOSED,2017-04-25T22:46:56Z,2017-05-03T20:03:12Z,2017-05-03T20:03:12Z,,tovahmarkowitz,https://github.com/hochwagenlab/ChIPseq_functions/issues/5
MDU6SXNzdWUyMjQzMTAxMzM=,Viji's suggestions related to error/output files,CLOSED,2017-04-26T00:31:19Z,2017-04-26T00:55:43Z,2017-04-26T00:55:43Z,"Save final file as: $CHIP_$JOBID.out

Incorporate delimiters to make easier to read long outputs.

Send e-mail after job is complete.",tovahmarkowitz,https://github.com/hochwagenlab/ChIPseq_functions/issues/6
MDU6SXNzdWUyMjQzMTU2MDA=,Incorporate $TAGC into output name,CLOSED,2017-04-26T01:14:49Z,2017-04-26T16:02:18Z,2017-04-26T16:02:18Z,"If $TAGC exists (or was defined within pipeline), use this name.
Otherwise use $CHIP.",tovahmarkowitz,https://github.com/hochwagenlab/ChIPseq_functions/issues/7
MDU6SXNzdWUyMjQzMTU4MzE=,When $CHIP includes *,CLOSED,2017-04-26T01:16:45Z,2017-05-03T20:03:12Z,2017-05-03T20:03:12Z,"When $CHIP includes *, it is treated differently in different locations in the pipeline.
MACS2_pipeline_$CHIP.txt also includes * in original file, but not in ChIPseq_closing.sbatch",tovahmarkowitz,https://github.com/hochwagenlab/ChIPseq_functions/issues/8
MDU6SXNzdWUyMjQ5MDMzNDk=,Naming error file when running replicates,CLOSED,2017-04-27T20:27:23Z,2017-05-03T20:03:12Z,2017-05-03T20:03:12Z,Use REP to name error file.,luisvalesilva,https://github.com/hochwagenlab/ChIPseq_functions/issues/9
