commit_sha,commit_author_name,commit_author_email,commit_message,commit_date,login
7d038a6b62b300dc8c26b392e2749f12dfaf3111,tapsley,tyler.apsley@gmail.com,"results

put the contigs in their own txt files to submit with that paper",2018-11-10T04:23:35Z,tapsley
e32d248d07b97333f3a6173ba1183a0836b6b9d2,trevorlyman,trevorlyman94@gmail.com,Changed the way the best result is chosen. Best n50 then choose the result with the max contig size.,2018-11-10T00:29:11Z,tapsley
3a1de91b4823988f4e3f054d7508267e5d1d7862,trevorlyman,trevorlyman94@gmail.com,Adding computed data,2018-11-09T23:26:33Z,tapsley
7a086df8ff008dfd9293df29954b69ce35a703c9,trevorlyman,trevorlyman94@gmail.com,"Computed some data, everything but the largest real.",2018-11-09T22:34:11Z,tapsley
1f419ad8f3f5bcfbc748ac6a828cc4ad07b0d48a,trevorlyman,trevorlyman94@gmail.com,"Setup some testing, it kind of works.",2018-11-08T23:35:40Z,tapsley
4ec68516cc983ab36a5a9b8fa2240e37d7863e06,trevorlyman,trevorlyman94@gmail.com,Moved some stuff around. Finding Contigs in the largest dataset is too slow.,2018-11-08T18:14:13Z,tapsley
dcbe3a56c943692e148810099c7c125439102789,trevorlyman,trevorlyman94@gmail.com,Refactored a bit,2018-11-07T16:49:24Z,tapsley
4cd43219e6972cd5b29d204424f58cd7852ab2d8,tapsley,tyler.apsley@gmail.com,start of the project,2018-11-06T19:31:36Z,tapsley
2a280a79b5e81bb1bbcfac0707225c9ae3b3e246,tapsley,tyler.apsley@gmail.com,Initial commit,2018-11-06T18:04:17Z,tapsley
