commit_sha,commit_author_name,commit_author_email,commit_message,commit_date,login
cfa829eb3a7f2834f4c4f376691bb3eed27c96af,Jessica-Pan,52299745+Jessica-Pan@users.noreply.github.com,Rename creating output from sequence_alignments copy.py to creating output from sequence_alignments.py,2019-10-29T14:32:55Z,Jessica-Pan
50c42ad149577f81cff37e491e21820d85641e7b,Jessica-Pan,52299745+Jessica-Pan@users.noreply.github.com,"Delete creating output from sequence_alignments.py

Deleted a redundant, not completely functional file",2019-10-29T14:32:17Z,Jessica-Pan
96f172b6d1a2aaa9b6d01351ea02ab5447ad2126,Jessica-Pan,52299745+Jessica-Pan@users.noreply.github.com,"Add files via upload

Fixed additional outputs for mut1, mut2, and MI (formatting and functionality).",2019-09-21T23:43:45Z,Jessica-Pan
eca685d9dd9936df325450574dccfef9668ff40b,Jessica Pan,Jessica@jessicas-air-3.attlocal.net,"adding outputs for mut1, mut2 and MI",2019-09-16T03:18:48Z,N/A
b2077188f6cd6395c3ca9d7f5ab4d4221966d58f,Jessica-Pan,52299745+Jessica-Pan@users.noreply.github.com,Add files via upload,2019-09-16T03:06:05Z,Jessica-Pan
d1474be1ae9025c6d4e35f7aab98472c8e63115c,Jessica Pan,jessicapan@Jessicas-MacBook-Pro.local,"minor, finalizing changes",2019-08-09T22:40:06Z,N/A
0f5a275bc5c26347bfac4074bebc99545c19c537,Jessica Pan,jessicapan@Jessicas-MacBook-Pro.local,Added word doc with description of project,2019-08-08T20:06:03Z,N/A
5dabd3571fba86867a192b7a1577dd8116d364bf,Jessica Pan,jessicapan@Jessicas-MacBook-Pro.local,"Updated readme, file names, and variable integration",2019-08-08T19:51:58Z,N/A
02bd5364f698862dcbe77672af49a5132b75fd63,Jessica Pan,jessicapan@Jessicas-MacBook-Pro.local,Initializing,2019-08-08T19:27:49Z,N/A
