commit_sha,commit_author_name,commit_author_email,commit_message,commit_date,author_type,login
9e1dcf48e93fdf92f38a5dccaf6b3f6c7cdfa377,Easy Build,easybuild@igb.illinois.edu,Reverted a fix for homeDir.,2018-06-13T19:04:28Z,Human,N/A
3f029b2a3c3b63111839b0168ef0821c801cd640,Easy Build,easybuild@igb.illinois.edu,Removed all homeDir variables and remove perl lib variable,2018-06-13T18:20:49Z,Human,N/A
8c3cbb283abe475d151150b5dc8807d8c53a6d83,Easy Build,easybuild@igb.illinois.edu,Fixed some homedir paths to use $ENV{'HOMER_DATA'} instead,2018-06-13T18:08:26Z,Human,N/A
6b6c568106ac5923164f115a866ed720c0c13baa,David Slater,dslater@dslater-lnx.igb.illinois.edu,"Added .gitignore
Set cpp/SeqTag.cpp to use HOMER_DATA environmental variable",2018-03-20T16:12:07Z,Human,N/A
5d49ff32120f101f7eb0e49cafa4687d4ce570d6,David Slater,dslater@dslater-lnx.igb.illinois.edu,Updated Makefile to delete binary files in bin folder on 'make clean',2018-03-20T15:42:55Z,Human,N/A
1adef120636f9c4362b8d2dc87d40ae9ec2c23f1,Easy Build,easybuild@igb.illinois.edu,Did a 'make clean' to remove object files,2018-02-23T19:43:28Z,Human,N/A
91979949c6b2fcd7a785f01b016162e3ae39a414,Easy Build,easybuild@igb.illinois.edu,Updated perl files to use HOMER_DATA enviroment variable,2018-02-23T19:39:21Z,Human,N/A
2f798b834d000bb28674bb2bd2b2052a3f1be9e5,Easy Build,easybuild@igb.illinois.edu,Uploaded version 4.9.1,2018-02-23T19:36:35Z,Human,N/A
