commit_sha,commit_author_name,commit_author_email,commit_message,commit_date,login
8084f5ccca845894f7ee3434dc3a9d3b6c442b51,gargiimishra,gargiitk@gmail.com,machine learning algorithms added for predicting protein abudance in liver cell lines,2023-09-25T18:47:22Z,gargiimishra
3232de24235b0dafdda4a4a56c80345883a54e1a,gargiimishra,gargiitk@gmail.com,data wrangling of protein data,2023-09-19T20:01:46Z,gargiimishra
c27ed8280cbe116aab7902b3e35afc2a53cc1ab3,gargiimishra,gargiitk@gmail.com,added details of files,2023-09-17T20:38:39Z,gargiimishra
0cc716482c9862663ecddb3a4d7c3eefd77c74ad,gargiimishra,gargiitk@gmail.com,Analysis file for kinase abundance prediction using sequence count,2023-09-17T20:27:34Z,gargiimishra
c94a95ebf55aa90913f369742fd311c97cb76d54,gargiimishra,gargiitk@gmail.com,Adding CCLE protein abundance anlysis,2023-09-16T17:50:17Z,gargiimishra
1f802bb401ac90096412bc1a704c167b37f8bac7,Gargi Mishra,gargiitk@gmail.com,Initial commit,2023-09-16T17:25:48Z,gargiimishra
