commit_sha,commit_author_name,commit_author_email,commit_message,commit_date,login
0b04a330aa80ef7d9946bb909a1442af8630e0ad,Phil Morley,runninggee57@gmail.com,"Matrix was one too small in both dimensions.  Small bugs in creation of matrices.  Traceback was not doing things right, fixed.",2013-05-08T22:59:32Z,runninggee57
e7882c2028c7d45b357af0e15c1904060553837f,Phil Morley,runninggee57@gmail.com,"Fixed small glitches causing bad alignments, it still doesn't like huge gaps which current optimal alignment has at beginning",2013-05-06T22:00:41Z,runninggee57
024f00d0d1322db5132d85924e96f4d1a099dc7f,Phil Morley,runninggee57@gmail.com,Added a method that uses the Hirschberg algorithm which computes alignments using linear space and only twice the time of dynamic programming.  Not currently outputting correct alignment,2013-05-06T21:44:42Z,runninggee57
0a1aa8b0566d448ad9ebaa650e1710efeaebd948,Phil Morley,runninggee57@gmail.com,Added a submatrix class that can build itself from file and has a better interface.  Test included,2013-05-06T21:43:58Z,runninggee57
f02c65c38459f0250b7d109709544cbb7b7f9b33,Phil Morley,runninggee57@gmail.com,"Made reading sequence file more generic, returning array of 2 sequences",2013-05-06T21:29:25Z,runninggee57
9fac6cbe0c2c440ea19c7c7b9df4f429200a3bb8,Phil Morley,runninggee57@gmail.com,Initial commit of ported c to java code.  Keep sequences around 500 to avoid running out of memory,2013-05-06T06:28:54Z,runninggee57
